product_category_tree,product_name,description
0,Home Furnishing,Elegance Polyester Multicolor Abstract Eyelet Door Curtain,"Key Features of Elegance Polyester Multicolor Abstract Eyelet Door Curtain Floral Curtain,Elegance Polyester Multicolor Abstract Eyelet Door Curtain (213 cm in Height, Pack of 2) Price: Rs. 899 This curtain enhances the look of the interiors.This curtain is made from 100% high quality polyester fabric.It features an eyelet style stitch with Metal Ring.It makes the room environment romantic and loving.This curtain is ant- wrinkle and anti shrinkage and have elegant apparance.Give your home a bright and modernistic appeal with these designs. The surreal attention is sure to steal hearts. These contemporary eyelet and valance curtains slide smoothly so when you draw them apart first thing in the morning to welcome the bright sun rays you want to wish good morning to the whole world and when you draw them close in the evening, you create the most special moments of joyous beauty given by the soothing prints. Bring home the elegant curtain that softly filters light in your room so that you get the right amount of sunlight.,Specifications of Elegance Polyester Multicolor Abstract Eyelet Door Curtain (213 cm in Height, Pack of 2) General Brand Elegance Designed For Door Type Eyelet Model Name Abstract Polyester Door Curtain Set Of 2 Model ID Duster25 Color Multicolor Dimensions Length 213 cm In the Box Number of Contents in Sales Package Pack of 2 Sales Package 2 Curtains Body & Design Material Polyester"
1,Baby Care,Sathiyas Cotton Bath Towel,"Specifications of Sathiyas Cotton Bath Towel (3 Bath Towel, Red, Yellow, Blue) Bath Towel Features Machine Washable Yes Material Cotton Design Self Design General Brand Sathiyas Type Bath Towel GSM 500 Model Name Sathiyas cotton bath towel Ideal For Men, Women, Boys, Girls Model ID asvtwl322 Color Red, Yellow, Blue Size Mediam Dimensions Length 30 inch Width 60 inch In the Box Number of Contents in Sales Package 3 Sales Package 3 Bath Towel"
2,Baby Care,Eurospa Cotton Terry Face Towel Set,"Key Features of Eurospa Cotton Terry Face Towel Set Size: small Height: 9 inch GSM: 360,Eurospa Cotton Terry Face Towel Set (20 PIECE FACE TOWEL SET, Assorted) Price: Rs. 299 Eurospa brings to you an exclusively designed, 100% soft cotton towels of export quality. All our products have soft texture that takes care of your skin and gives you that enriched feeling you deserve. Eurospa has been exporting its bath towels to lot of renowned brands for last 10 years and is famous for its fine prints, absorbency, softness and durability. NOTE: Our product is 100% cotton, so it is susceptible to shrinkage. Product color may vary from the picture. Size may vary by ±3% WASH CARE: Wash in cold Water, Do not Iron, Do not Bleach, Flat dry, Wash before first use. SIZE- FACE TOWEL - 23 cms X 23 cms.,Specifications of Eurospa Cotton Terry Face Towel Set (20 PIECE FACE TOWEL SET, Assorted) Bath Towel Features Material Cotton Terry Design SHUVAM General Brand Eurospa GSM 360 Type Face Towel Set Model Name SHUVAM20PCFTSETASSORTED Ideal For Boys, Girls, Men, Women Model ID SHUVAM20PCFTSETASSORTED Size small Color Assorted Dimensions Weight 350 g Length 9 inch Width 9 inch In the Box Number of Contents in Sales Package 20 Sales Package 20 PIECE FACE TOWEL SET"
3,Home Furnishing,SANTOSH ROYAL FASHION Cotton Printed King sized Double Bedsheet,"Key Features of SANTOSH ROYAL FASHION Cotton Printed King sized Double Bedsheet Royal Bedsheet Perfact for Wedding & Gifting,Specifications of SANTOSH ROYAL FASHION Cotton Printed King sized Double Bedsheet (1 Bedsheet,2 Pillow Cover, Multicolor) General Brand SANTOSH ROYAL FASHION Machine Washable Yes Type Flat Material Cotton Model Name Gold Design Royal Cotton Printed Wedding & Gifted Double Bedsheet With 2 Pillow cover Model ID goldbedi-38 Color Multicolor Size King Fabric Care Machine Wash, Do Not Bleach Dimensions Flat Sheet Width 90 inch / 230 cm Fitted Sheet Width 228 cm Pillow Cover Width 16 inch / 43 cm Pillow Cover Length 28 inch / 72 cm Fitted Sheet Depth 280 cm Fitted Sheet Length 278 cm Flat Sheet Depth 282 cm Flat Sheet Length 110 inch / 280 cm In the Box Number of Contents in Sales Package 1 Sales Package 1 Bedsheet,2 Pillow Cover"
4,Home Furnishing,Jaipur Print Cotton Floral King sized Double Bedsheet,"Key Features of Jaipur Print Cotton Floral King sized Double Bedsheet 100% cotton,Jaipur Print Cotton Floral King sized Double Bedsheet (1 bed sheet 2 pillow cover, White) Price: Rs. 998 This nice bed sheet made up of 100% cotton to give you comfort. This bed sheet is hand printed. This bedsheet gives nice look to your room And its fast colour and good quality gives this bedsheet long life.,Specifications of Jaipur Print Cotton Floral King sized Double Bedsheet (1 bed sheet 2 pillow cover, White) General Machine Washable Yes Brand Jaipur Print Type Flat Model Name jaipur117 Material Cotton Thread Count 140 Model ID jaipur117 Fabric Care machinewash, do not bleach Size King Color White Warranty waranty of the product only for manufacturing defect only and product will exchange onle when it is not used and returne its origional packing Dimensions Flat Sheet Width 86 inch / 220 cm Fitted Sheet Width 0 cm Pillow Cover Width 17 inch / 45 cm Pillow Cover Length 29 inch / 75 cm Weight 900 g Fitted Sheet Depth 0 cm Fitted Sheet Length 0 cm Flat Sheet Depth 0.2 cm Flat Sheet Length 104 inch / 265 cm In the Box Number of Contents in Sales Package 1 Sales Package 1 bed sheet 2 pillow cover"
5,Watches,Maserati Time R8851116001 Analog Watch  - For Boys,"Maserati Time R8851116001 Analog Watch  - For Boys - Buy Maserati Time R8851116001 Analog Watch  - For Boys  R8851116001 Online at Rs.24400 in India Only at Flipkart.com. - Great Discounts, Only Genuine Products, 30 Day Replacement Guarantee, Free Shipping. Cash On Delivery!"
6,Watches,"Camerii WM64 Elegance Analog Watch  - For Men, Boys","Camerii WM64 Elegance Analog Watch  - For Men, Boys - Buy Camerii WM64 Elegance Analog Watch  - For Men, Boys  WM64 Online at Rs.449 in India Only at Flipkart.com. - Great Discounts, Only Genuine Products, 30 Day Replacement Guarantee, Free Shipping. Cash On Delivery!"
7,Watches,T STAR UFT-TSW-005-BK-BR Analog Watch  - For Boys,"T STAR UFT-TSW-005-BK-BR Analog Watch  - For Boys
                         Price: Rs. 399
				
			Whether you are on your way to work or travelling abroad with family, lifestyle accessories like watches, wallets and belts help to add a touch of sophistication and class to your otherwise mundane and regular daily wear. When it all comes down to it, suave leather belts and intricately designed and finished timepieces are what separate you from the rest.
Whether you are on your way to work or travelling abroad with family, lifestyle accessories like watches, wallets and belts help to add a touch of sophistication and class to your otherwise mundane and regular daily wear. When it all comes down to it, suave leather belts and intricately designed and finished timepieces are what separate you from the rest."
8,Watches,"Alfajr WY16B Youth Digital Watch  - For Men, Boys","Alfajr WY16B Youth Digital Watch  - For Men, Boys - Buy Alfajr WY16B Youth Digital Watch  - For Men, Boys  WY16B Online at Rs.4995 in India Only at Flipkart.com. Azan Times ( For All Cities Around The World ), Prayer Reminders, Qibla Direction, Hijri And Gregorian Calnedars, Qur'An Bookmark, Daily Alrams - Great Discounts, Only Genuine Products, 30 Day Replacement Guarantee, Free Shipping. Cash On Delivery!"
9,Watches,"TAG Heuer CAU1116.BA0858 Formula 1 Analog Watch  - For Boys, Men","TAG Heuer CAU1116.BA0858 Formula 1 Analog Watch  - For Boys, Men - Buy TAG Heuer CAU1116.BA0858 Formula 1 Analog Watch  - For Boys, Men  CAU1116.BA0858 Online at Rs.107750 in India Only at Flipkart.com. Swiss-made, Quartz movement, Scratch resistant, Sapphire crystal glass, Water resistant to 200 metres, Feature Chronograph - Great Discounts, Only Genuine Products, 30 Day Replacement Guarantee, Free Shipping. Cash On Delivery!"
10,Watches,"Calibro SW-125 Analog-Digital Watch  - For Men, Boys","Calibro SW-125 Analog-Digital Watch  - For Men, Boys
                         Price: Rs. 699
				
			CALIBRO presents MTG Black Dial Round Watch. This is a fashionable watch from MTG that adds to your style statement. This brand is known for its usage of quality material in making appealing watches. It understands the needs of youth so well that it is able to present wide range of watches to its customers. The variety in design, style and youthful approach is very well executed by this brand. Get one and see how brilliantly it leads other brands in style, finish and everything else that matters.
CALIBRO presents MTG Black Dial Round Watch. This is a fashionable watch from MTG that adds to your style statement. This brand is known for its usage of quality material in making appealing watches. It understands the needs of youth so well that it is able to present wide range of watches to its customers. The variety in design, style and youthful approach is very well executed by this brand. Get one and see how brilliantly it leads other brands in style, finish and everything else that matters."
11,Watches,"Cartier W6701005 Analog Watch  - For Boys, Men","Cartier W6701005 Analog Watch  - For Boys, Men - Buy Cartier W6701005 Analog Watch  - For Boys, Men  W6701005 Online at Rs.201000 in India Only at Flipkart.com. - Great Discounts, Only Genuine Products, 30 Day Replacement Guarantee, Free Shipping. Cash On Delivery!"
12,Watches,"Lois Caron LCS-4032 Analog Watch  - For Boys, Men","Lois Caron LCS-4032 Analog Watch  - For Boys, Men - Buy Lois Caron LCS-4032 Analog Watch  - For Boys, Men  LCS-4032 Online at Rs.399 in India Only at Flipkart.com. - Great Discounts, Only Genuine Products, 30 Day Replacement Guarantee, Free Shipping. Cash On Delivery!"
13,Watches,"Titan 1639SL03 Analog Watch  - For Boys, Men","Titan 1639SL03 Analog Watch  - For Boys, Men - Buy Titan 1639SL03 Analog Watch  - For Boys, Men  1639SL03 Online at Rs.1695 in India Only at Flipkart.com. - Great Discounts, Only Genuine Products, 30 Day Replacement Guarantee, Free Shipping. Cash On Delivery!"
14,Watches,"Srushti Art Jewelry Megnet_Led_Sport_BlackRed1 Digital Watch  - For Men, Women, Boys, Girls","Srushti Art Jewelry Megnet_Led_Sport_BlackRed1 Digital Watch  - For Men, Women, Boys, Girls - Buy Srushti Art Jewelry Megnet_Led_Sport_BlackRed1 Digital Watch  - For Men, Women, Boys, Girls  Megnet_Led_Sport_BlackRed1 Online at Rs.200 in India Only at Flipkart.com. Led Watch, Sports Led, Megnet watch, Fresh arrival, latest, fancy, Srushti, GirlsWatch, Men, Women, Boys, Wrist Watches - Great Discounts, Only Genuine Products, 30 Day Replacement Guarantee, Free Shipping. Cash On Delivery!"
15,Watches,"Escort E-1700-906_Blk Analog Watch  - For Men, Boys","Escort E-1700-906_Blk Analog Watch  - For Men, Boys
                         Price: Rs. 1,829
				
			If you have it, flaunt it! If this is your mantra then hit the streets in style wearing this black coloured analog watch for men from the house of Escort. The casing adds more appeal to this timepiece that can be worn on a rainy day, all thanks to its water resistance upto 10 atm.
If you have it, flaunt it! If this is your mantra then hit the streets in style wearing this black coloured analog watch for men from the house of Escort. The casing adds more appeal to this timepiece that can be worn on a rainy day, all thanks to its water resistance upto 10 atm."
16,Watches,Jack klein BlackLed Digital Watch  - For Boys,"Jack klein BlackLed Digital Watch  - For Boys - Buy Jack klein BlackLed Digital Watch  - For Boys  BlackLed Online at Rs.150 in India Only at Flipkart.com. - Great Discounts, Only Genuine Products, 30 Day Replacement Guarantee, Free Shipping. Cash On Delivery!"
17,Watches,"North Moon IW-005-FK Silicone Ion Digital Watch  - For Boys, Girls, Women","North Moon IW-005-FK Silicone Ion Digital Watch  - For Boys, Girls, Women - Buy North Moon IW-005-FK Silicone Ion Digital Watch  - For Boys, Girls, Women  IW-005-FK Online at Rs.150 in India Only at Flipkart.com. - Great Discounts, Only Genuine Products, 30 Day Replacement Guarantee, Free Shipping. Cash On Delivery!"
18,Watches,"Franck Bella FB74C Analog Watch  - For Boys, Men","Franck Bella FB74C Analog Watch  - For Boys, Men - Buy Franck Bella FB74C Analog Watch  - For Boys, Men  FB74C Online at Rs.780 in India Only at Flipkart.com. - Great Discounts, Only Genuine Products, 30 Day Replacement Guarantee, Free Shipping. Cash On Delivery!"
19,Watches,Ridas Apl_led_black Apple Shape Digital Watch  - For Boys,"Ridas Apl_led_black Apple Shape Digital Watch  - For Boys - Buy Ridas Apl_led_black Apple Shape Digital Watch  - For Boys  Apl_led_black Online at Rs.249 in India Only at Flipkart.com. - Great Discounts, Only Genuine Products, 30 Day Replacement Guarantee, Free Shipping. Cash On Delivery!"
20,Watches,"Skmei AD1057-Dark-Orange Sports Analog-Digital Watch  - For Men, Boys","Skmei AD1057-Dark-Orange Sports Analog-Digital Watch  - For Men, Boys - Buy Skmei AD1057-Dark-Orange Sports Analog-Digital Watch  - For Men, Boys  AD1057-Dark-Orange Online at Rs.1199 in India Only at Flipkart.com. Digital Chronograph, Alarm Watch, Light Function, Date & Month Display - Great Discounts, Only Genuine Products, 30 Day Replacement Guarantee, Free Shipping. Cash On Delivery!"
21,Watches,Now SP-ETHNIC Analog Watch  - For Boys,"Now SP-ETHNIC Analog Watch  - For Boys - Buy Now SP-ETHNIC Analog Watch  - For Boys  SP-ETHNIC Online at Rs.600 in India Only at Flipkart.com. - Great Discounts, Only Genuine Products, 30 Day Replacement Guarantee, Free Shipping. Cash On Delivery!"
22,Watches,"Franck Bella FB127A Analog Watch  - For Boys, Men","Franck Bella FB127A Analog Watch  - For Boys, Men - Buy Franck Bella FB127A Analog Watch  - For Boys, Men  FB127A Online at Rs.999 in India Only at Flipkart.com. - Great Discounts, Only Genuine Products, 30 Day Replacement Guarantee, Free Shipping. Cash On Delivery!"
23,Watches,"Skmei DG0939-Red Sports Digital Watch  - For Men, Boys","Skmei DG0939-Red Sports Digital Watch  - For Men, Boys - Buy Skmei DG0939-Red Sports Digital Watch  - For Men, Boys  DG0939-Red Online at Rs.999 in India Only at Flipkart.com. Digital Chronograph, Alarm Watch, Light Function, Date & Month Display - Great Discounts, Only Genuine Products, 30 Day Replacement Guarantee, Free Shipping. Cash On Delivery!"
24,Watches,"fastrack 38015PL01 Analog Watch  - For Men, Boys","fastrack 38015PL01 Analog Watch  - For Men, Boys - Buy fastrack 38015PL01 Analog Watch  - For Men, Boys  38015PL01 Online at Rs.2495 in India Only at Flipkart.com. Stainless steel back cover. Hybrid case construction for a sportier and more rugged look with increased shock resistance. High precision quartz analogue movement. - Great Discounts, Only Genuine Products, 30 Day Replacement Guarantee, Free Shipping. Cash On Delivery!"
25,Watches,"Alfajr WQ18 Qibla Compass Digital Watch  - For Men, Boys, Girls","Alfajr WQ18 Qibla Compass Digital Watch  - For Men, Boys, Girls - Buy Alfajr WQ18 Qibla Compass Digital Watch  - For Men, Boys, Girls  WQ18 Online at Rs.7495 in India Only at Flipkart.com. Qibla Compass, Light, Azan Time Calculation - Great Discounts, Only Genuine Products, 30 Day Replacement Guarantee, Free Shipping. Cash On Delivery!"
26,Watches,"Disney 98189 Analog Watch  - For Boys, Girls","Disney 98189 Analog Watch  - For Boys, Girls - Buy Disney 98189 Analog Watch  - For Boys, Girls  98189 Online at Rs.900 in India Only at Flipkart.com. - Great Discounts, Only Genuine Products, 30 Day Replacement Guarantee, Free Shipping. Cash On Delivery!"
27,Watches,Disney DW100405 Digital Watch  - For Boys,"Disney DW100405 Digital Watch  - For Boys - Buy Disney DW100405 Digital Watch  - For Boys  DW100405 Online at Rs.1345 in India Only at Flipkart.com. - Great Discounts, Only Genuine Products, 30 Day Replacement Guarantee, Free Shipping. Cash On Delivery!"
28,Watches,"Vizion 8502-7PURPLE Sports Series Digital Watch  - For Boys, Girls","Vizion 8502-7PURPLE Sports Series Digital Watch  - For Boys, Girls
                         Price: Rs. 595
				
			Brand: Vizion,Sports Series watch for Kids,1 year manufacturer warranty,Digital display,Automatic movement,Metal Case and solid body ,Dial shape:Round,Dial dimension:22mm ,Strap material:Silicone ,Strap width:20mm,Water resistant,Night display cold backLight, Daily Alarm,Hour minute second ,date week display, 12/24 hour format,Attractive brand packaging- Tuff plastic box,Note: In case of non-receipt of warranty card, please intimate us within 48 hours,Disclaimer: Product color may slightly vary due to photographic lighting sources or your monitor settings (The image has been enlarged for better viewing)
Brand: Vizion,Sports Series watch for Kids,1 year manufacturer warranty,Digital display,Automatic movement,Metal Case and solid body ,Dial shape:Round,Dial dimension:22mm ,Strap material:Silicone ,Strap width:20mm,Water resistant,Night display cold backLight, Daily Alarm,Hour minute second ,date week display, 12/24 hour format,Attractive brand packaging- Tuff plastic box,Note: In case of non-receipt of warranty card, please intimate us within 48 hours,Disclaimer: Product color may slightly vary due to photographic lighting sources or your monitor settings (The image has been enlarged for better viewing)"
29,Watches,"Elantra S 10 Analog Watch  - For Boys, Men","Elantra S 10 Analog Watch  - For Boys, Men - Buy Elantra S 10 Analog Watch  - For Boys, Men  S 10 Online at Rs.950 in India Only at Flipkart.com. - Great Discounts, Only Genuine Products, 30 Day Replacement Guarantee, Free Shipping. Cash On Delivery!"
30,Watches,"Marvel DW100243 Digital Watch  - For Boys, Girls","Marvel DW100243 Digital Watch  - For Boys, Girls - Buy Marvel DW100243 Digital Watch  - For Boys, Girls  DW100243 Online at Rs.299 in India Only at Flipkart.com. Buckle Clasp, Multi-color Strap, Contemporary Dial - Great Discounts, Only Genuine Products, 30 Day Replacement Guarantee, Free Shipping. Cash On Delivery!"
31,Watches,"Lenco Bdblue Tango Analog Watch  - For Men, Boys","Lenco Bdblue Tango Analog Watch  - For Men, Boys - Buy Lenco Bdblue Tango Analog Watch  - For Men, Boys  Bdblue Online at Rs.599 in India Only at Flipkart.com. Sports Watch, Casual Watch, Big Size Dial, Colourful Strap - Great Discounts, Only Genuine Products, 30 Day Replacement Guarantee, Free Shipping. Cash On Delivery!"
32,Watches,"D'Signer 681GM_WHT Analog Watch  - For Men, Boys","D'Signer 681GM_WHT Analog Watch  - For Men, Boys - Buy D'Signer 681GM_WHT Analog Watch  - For Men, Boys  681GM_WHT Online at Rs.6645 in India Only at Flipkart.com. - Great Discounts, Only Genuine Products, 30 Day Replacement Guarantee, Free Shipping. Cash On Delivery!"
33,Home Furnishing,SANTOSH ROYAL FASHION Cotton Embroidered Diwan Set,"Key Features of SANTOSH ROYAL FASHION Cotton Embroidered Diwan Set Color: Multicolor No of Contents: 8 Diwan Sheet Length225 cm Cushion Cover Length:40 cm,SANTOSH ROYAL FASHION Cotton Embroidered Diwan Set Price: Rs. 979 Add oodles of style to your home with an exciting range of designer furniture, furnishings, decor items and kitchenware. We promise to deliver best quality products at best prices.,Specifications of SANTOSH ROYAL FASHION Cotton Embroidered Diwan Set General Brand SANTOSH ROYAL FASHION Material Cotton Pattern Embroidered Style Code dsnsan-34 Color Multicolor Dimensions Bolster Cover Length 23 inch / 40 cm Cushion Cover Width 15 inch / 40 cm Diwan Sheet Length 88 inch / 225 cm Cushion Cover Length 15 inch / 40 cm Diwan Sheet Width 59 inch / 150 cm In the Box Number of Contents in Sales Package Pack of 8 Sales Package 1 Diwan Sheet,5 Cushion Covers, 2 Bolster Covers Additional Features Fabric Care Machine Washable, Do Not Soak"
34,Home Furnishing,House This Queen Cotton Duvet Cover,"Key Features of House This Queen Cotton Duvet Cover Material:100% Cotton Outer.Inner Polyfill Thrade :210 Dimension: Duvet Cover 229X274 Cms 1 Double Duvet Cover,Specifications of House This Queen Cotton Duvet Cover (Grey) General Brand House This Closure Button Design Code P21821 Material Cotton Pattern Printed Thread Count 210 Style Code Dco-Smart Stripe-Black Grey Size Queen Color Grey Dimensions Length 107 inch / 274 cm Width 90 inch / 229 cm In the Box Number of Contents in Sales Package Pack of 1 Fabric Care Machine Washable, Do Not Soak Additional Features Reversible No"
35,Home Furnishing,Riva Carpets Cotton Free Bath Mat Classic Loop Shag Bathmat_RI-527,Buy Riva Carpets Cotton Free Bath Mat Classic Loop Shag Bathmat_RI-527 at Rs. 1799 at Flipkart.com. Only Genuine Products. Free Shipping. Cash On Delivery!
36,Home Decor & Festive Needs,Myesquire Ceramic Burner Pot Lemongrass Liquid Air Freshener,"Myesquire Ceramic Burner Pot Lemongrass Liquid Air Freshener (30 ml)
                         Price: Rs. 245
				
			Illuminate Every Corner Of Your Living Room In Style With This Home Fragrance Electric Burner Combo With Fragrance That Is Brought To You By Myesquire. This Is A Very Unique, Useful And Value for Money Product For Home Decoration And Fragrance. This Unique Combo Contains Aroma Burner With All Accessories and is ready to use . Put A Small Amount 1-2 Tea Spoon Of Aroma Oil On The Bowl Surface And Light The Tea Light and After Few Minutes As The Oil Heats Up, The Fragrance Will Spread In The Room. And You Will Be All Set To Enjoy The Captivating Aroma. Keep It Away From Children As Surface Becomes Hot.
Illuminate Every Corner Of Your Living Room In Style With This Home Fragrance Electric Burner Combo With Fragrance That Is Brought To You By Myesquire. This Is A Very Unique, Useful And Value for Money Product For Home Decoration And Fragrance. This Unique Combo Contains Aroma Burner With All Accessories and is ready to use . Put A Small Amount 1-2 Tea Spoon Of Aroma Oil On The Bowl Surface And Light The Tea Light and After Few Minutes As The Oil Heats Up, The Fragrance Will Spread In The Room. And You Will Be All Set To Enjoy The Captivating Aroma. Keep It Away From Children As Surface Becomes Hot."
37,Kitchen & Dining,Dungri India Craft Ducjug010-ducgl012-2 Jug Glass Set,"Key Features of Dungri India Craft Ducjug010-ducgl012-2 Jug Glass Set Jug: Height- 8 inches, Dia - 4.2 inches, Depth 7.5 inches, Width 7 inches,capacity 1744 ml, Weight - 430 Grams,Dungri India Craft Ducjug010-ducgl012-2 Jug Glass Set (Copper) Price: Rs. 1,399 Copper Utensils And Serving Copper Ware Helped To Prevent The Spread Of Diseases. In Many Tests It Showed That 99.9% Of The Bacteria On Copper Alloy Surfaces (With 65% Or Greater Copper Content) Were Eliminated Within 2 Hours Of Exposure. According To Research At Southampton University In The U.K., Mrsa Microbes Remain Alive On Stainless Steel Surfaces For Up To Three Days, Whereas The Same Microbes On A Copper Surface Are Eliminated Within 90 Minutes. These Copper Serving Ware Are Preferred Because It Is Durable And It Has Excellent Characteristics. The Ageless Use Of Copper Bears Testimony To Its Myriad Virtues And Everlasting Appeal. Its Therapeutic Value Has Been Handed Down To Us Through The Ages. In Fact, Water Stored In Copper Ware Is Virtually The Elixir Of Life. Purified, It Helps To Regulate Digestion And Cardiac Orders, The Basis Of Good Health, As Practiced By Ayurveda And Rishits From Old Vedic Times.   Care Tips:  * Clean Your Copperware By Hand And Avoid Dishwasher As The Detergent Can Cause Oxidation Leading To Permanat Damage. * Use A Solution Of Equal Quantities Vinegar Or Lemon Juice And Salt Diluted With Some Water At Such Times But Don'T Use It Regularly. * Avoid Scratchy Cleaners Like Steel Wool. * A Simple, Soft Cleaning Liquid On Soap Base, Hot Water And A Soft Washing Cloth Is Best For Daily Use.,Specifications of Dungri India Craft Ducjug010-ducgl012-2 Jug Glass Set (Copper) General Brand Dungri India Craft Number of Glasses 2 Model Number Ducjug010-ducgl012-2 Type Jug Glass Set Glass Shape Tumblers Material Copper Capacity per Glass 320 ml Jug Capacity 1.7 L Color Gold Dimensions Jug Height 203 mm Glass Diameter 50 mm Jug Depth 190 mm Other Dimensions Glass: Dia - 2"", Height - 4"", capacity - 320 ml, Weight - 75 grams In the Box 1 Jug 2 Glass Set Additional Features Microwave Safe No Care Instructions For Better Washing Result Wash With Pitambari Cleaning Power"
38,Kitchen & Dining,BFT 6 W LED Bulb,"Key Features of BFT 6 W LED Bulb Pack of 1 Bulb,BFT 6 W LED Bulb (White) Price: Rs. 350 Introducing new technology in led lighting LED filament. Best suited for chandeliers table lamps and light fixtures in general as it spreads light 360-degrees,Specifications of BFT 6 W LED Bulb (White) General Brand BFT Model Number BFTCW6 Body and Design Features Material Glass Bulb Base B22 Lighting Features Light Color White Bulb Type LED Lumen 700 Power Features Power Consumption 6 W In the Box Sales Package 1 Bulb Pack of 1"
39,Home Furnishing,JMD Printed Cushions Cover,"Key Features of JMD Printed Cushions Cover Printed 40x40cm size Made of Cotton,Specifications of JMD Printed Cushions Cover (Pack of 2, 40 cm*40 cm, Multicolor) General Brand JMD Suitable For Cushions Design Code C03 Type Square Material Cotton Style Code C03 Pattern Printed Color Multicolor Dimensions Height 15 inch / 40 cm Width 15 inch / 40 cm Additional Features Reversible No In the Box Number of Contents in Sales Package Pack of 2 Sales Package Cushion Pillow Cover"
