product_category_tree,product_name,description
236,Home Decor & Festive Needs,Unique Design Mobile Stand Showpiece  -  15 cm,"Unique Design Mobile Stand Showpiece  -  15 cm (Wooden, Yellow)
                         Price: Rs. 350
				
			This Handcrafted Mobile Stand Is Made Of Wood And Decorated With Rajasthani Painting. It Is An Ideal Gift For Your Friends And Relatives. This Product Is Offered At Highly Economical Rates
This Handcrafted Mobile Stand Is Made Of Wood And Decorated With Rajasthani Painting. It Is An Ideal Gift For Your Friends And Relatives. This Product Is Offered At Highly Economical Rates"
237,Home Decor & Festive Needs,Lal Haveli Iron Wall Decorative Musician Showpiece  -  50.8 cm,Buy Lal Haveli Iron Wall Decorative Musician Showpiece  -  50.8 cm for Rs.6949 online. Lal Haveli Iron Wall Decorative Musician Showpiece  -  50.8 cm at best prices with FREE shipping & cash on delivery. Only Genuine Products. 30 Day Replacement Guarantee.
238,Kitchen & Dining,Metallino Hard Anodised Kadhai 1.2 L,Buy Metallino Hard Anodised Kadhai 1.2 L for Rs.588 online. Metallino Hard Anodised Kadhai 1.2 L at best prices with FREE shipping & cash on delivery. Only Genuine Products. 30 Day Replacement Guarantee.
239,Home Decor & Festive Needs,Ruchiworld Marble Pot Showpiece  -  4 cm,"Ruchiworld Marble Pot Showpiece  -  4 cm (Stoneware, Multicolor)
                         Price: Rs. 1,250
				
			It Is An Exclusive Show Piece For Your Drawing Room. A Surity Of Getting Admiration By Your Guests. Shop This Artistic Item At The Best Price.
It Is An Exclusive Show Piece For Your Drawing Room. A Surity Of Getting Admiration By Your Guests. Shop This Artistic Item At The Best Price."
240,Kitchen & Dining,Kosher Kadhai 5 L,Buy Kosher Kadhai 5 L for Rs.592 online. Kosher Kadhai 5 L at best prices with FREE shipping & cash on delivery. Only Genuine Products. 30 Day Replacement Guarantee.
241,Kitchen & Dining,Recon SuperChef Kadhai,Buy Recon SuperChef Kadhai for Rs.715 online. Recon SuperChef Kadhai at best prices with FREE shipping & cash on delivery. Only Genuine Products. 30 Day Replacement Guarantee.
242,Kitchen & Dining,"Indian Art Villa 2.3"" X 6.9"" X 2.3"" Handmade High Quality Stainless Steel Copper Dish Serving Indian Food Daal Curry Karahi Kadai Wok Bowl Kadhai 0.7 L","Buy Indian Art Villa 2.3"" X 6.9"" X 2.3"" Handmade High Quality Stainless Steel Copper Dish Serving Indian Food Daal Curry Karahi Kadai Wok Bowl Kadhai 0.7 L for Rs.750 online. Indian Art Villa 2.3"" X 6.9"" X 2.3"" Handmade High Quality Stainless Steel Copper Dish Serving Indian Food Daal Curry Karahi Kadai Wok Bowl Kadhai 0.7 L at best prices with FREE shipping & cash on delivery. Only Genuine Products. 30 Day Replacement Guarantee."
243,Kitchen & Dining,Suruchi Kadhai 4.5 L,Buy Suruchi Kadhai 4.5 L for Rs.965 online. Suruchi Kadhai 4.5 L at best prices with FREE shipping & cash on delivery. Only Genuine Products. 30 Day Replacement Guarantee.
244,Kitchen & Dining,Bergner Kadhai NA L,"Bergner Kadhai NA L (Aluminium, Non-stick)
                         Price: Rs. 1,499
				
			Get this strong kadai with tempered glass lid from Bergner and make a brilliant collection of utensils for your kitchen. 
Made of high quality stainless steel with diamond coating,
 these have quick heat distribution ability and are lightweight and corrosion resistant.
Get this strong kadai with tempered glass lid from Bergner and make a brilliant collection of utensils for your kitchen. 
Made of high quality stainless steel with diamond coating,
 these have quick heat distribution ability and are lightweight and corrosion resistant."
245,Kitchen & Dining,Kalash Kadhai 11.5 L,Buy Kalash Kadhai 11.5 L for Rs.1584 online. Kalash Kadhai 11.5 L at best prices with FREE shipping & cash on delivery. Only Genuine Products. 30 Day Replacement Guarantee.
246,Kitchen & Dining,Peacock Kadhai 3.8 L,Buy Peacock Kadhai 3.8 L for Rs.1155 online. Peacock Kadhai 3.8 L at best prices with FREE shipping & cash on delivery. Only Genuine Products. 30 Day Replacement Guarantee.
247,Kitchen & Dining,Leo Natura Paniarakkal 7 Hole Kadhai NA L,Buy Leo Natura Paniarakkal 7 Hole Kadhai NA L for Rs.649 online. Leo Natura Paniarakkal 7 Hole Kadhai NA L at best prices with FREE shipping & cash on delivery. Only Genuine Products. 30 Day Replacement Guarantee.
248,Home Decor & Festive Needs,Malhar Niko Male Doll Showpiece  -  25 cm,Buy Malhar Niko Male Doll Showpiece  -  25 cm for Rs.5436 online. Malhar Niko Male Doll Showpiece  -  25 cm at best prices with FREE shipping & cash on delivery. Only Genuine Products. 30 Day Replacement Guarantee.
249,Kitchen & Dining,Sumeet Hard Anodised 14 Kadhai 3 L,Buy Sumeet Hard Anodised 14 Kadhai 3 L for Rs.1045 online. Sumeet Hard Anodised 14 Kadhai 3 L at best prices with FREE shipping & cash on delivery. Only Genuine Products. 30 Day Replacement Guarantee.
250,Home Decor & Festive Needs,TRUE Bong,Buy TRUE Bong for Rs.549 online. TRUE Bong at best prices with FREE shipping & cash on delivery. Only Genuine Products. 30 Day Replacement Guarantee.
251,Kitchen & Dining,Kalash Kadhai 3.5 L,Buy Kalash Kadhai 3.5 L for Rs.549 online. Kalash Kadhai 3.5 L at best prices with FREE shipping & cash on delivery. Only Genuine Products. 30 Day Replacement Guarantee.
252,Kitchen & Dining,Metallino Kadhai NA L,Buy Metallino Kadhai NA L for Rs.721 online. Metallino Kadhai NA L at best prices with FREE shipping & cash on delivery. Only Genuine Products. 30 Day Replacement Guarantee.
253,Kitchen & Dining,Metallino Hard Anodised WGlass Lid Kadhai 3.5 L,Buy Metallino Hard Anodised WGlass Lid Kadhai 3.5 L for Rs.1132 online. Metallino Hard Anodised WGlass Lid Kadhai 3.5 L at best prices with FREE shipping & cash on delivery. Only Genuine Products. 30 Day Replacement Guarantee.
254,Home Decor & Festive Needs,The Crafts House Showpiece  -  6.5 cm,Buy The Crafts House Showpiece  -  6.5 cm for Rs.1499 online. The Crafts House Showpiece  -  6.5 cm at best prices with FREE shipping & cash on delivery. Only Genuine Products. 30 Day Replacement Guarantee.
255,Kitchen & Dining,Jaipan KD2.5 Kadhai 2.5 L,Buy Jaipan KD2.5 Kadhai 2.5 L for Rs.499 online. Jaipan KD2.5 Kadhai 2.5 L at best prices with FREE shipping & cash on delivery. Only Genuine Products. 30 Day Replacement Guarantee.
256,Home Decor & Festive Needs,Tiedribbons Mamma'S Fairies Gifts Tile Showpiece  -  28 cm,"Tiedribbons Mamma'S Fairies Gifts Tile Showpiece  -  28 cm (Ceramic, Multicolor)
                         Price: Rs. 699
				
			With a bright colour combination and a fantastic look this Tile is indeed an exclusive creation by the brand TiedRibbons. This wonderful show piece will make a fine addition to the prayer room, living room or even in your office. It is easy to maintain the good looks of this tile for years with a simple cloth wipe. The print is high on quality and will retain its brightness for long. It comes with a wooden easel stand and is easy to place on any table or shelf in your room. You can consider this tile as a wonderful gift option for house warming occasions and other festive occasions too. Shop with confidence! Sit back and enjoy shopping while we make sure to deliver this purchase for free right at your doorstep.
With a bright colour combination and a fantastic look this Tile is indeed an exclusive creation by the brand TiedRibbons. This wonderful show piece will make a fine addition to the prayer room, living room or even in your office. It is easy to maintain the good looks of this tile for years with a simple cloth wipe. The print is high on quality and will retain its brightness for long. It comes with a wooden easel stand and is easy to place on any table or shelf in your room. You can consider this tile as a wonderful gift option for house warming occasions and other festive occasions too. Shop with confidence! Sit back and enjoy shopping while we make sure to deliver this purchase for free right at your doorstep."
257,Home Decor & Festive Needs,Unravel India Showpiece  -  16 cm,Buy Unravel India Showpiece  -  16 cm for Rs.1749 online. Unravel India Showpiece  -  16 cm at best prices with FREE shipping & cash on delivery. Only Genuine Products. 30 Day Replacement Guarantee.
258,Home Decor & Festive Needs,Ruchikainternational ruc0015 Showpiece  -  4 cm,Buy Ruchikainternational ruc0015 Showpiece  -  4 cm for Rs.499 online. Ruchikainternational ruc0015 Showpiece  -  4 cm at best prices with FREE shipping & cash on delivery. Only Genuine Products. 30 Day Replacement Guarantee.
259,Kitchen & Dining,Nirlon Kadhai 3 L,Buy Nirlon Kadhai 3 L for Rs.785 online. Nirlon Kadhai 3 L at best prices with FREE shipping & cash on delivery. Only Genuine Products. 30 Day Replacement Guarantee.
260,Home Decor & Festive Needs,Monil Cow With Calf Showpiece  -  10.2 cm,Buy Monil Cow With Calf Showpiece  -  10.2 cm for Rs.520 online. Monil Cow With Calf Showpiece  -  10.2 cm at best prices with FREE shipping & cash on delivery. Only Genuine Products. 30 Day Replacement Guarantee.
261,Kitchen & Dining,Pristine Hard Anodised Kadhai 2 L,"Pristine Hard Anodised Kadhai 2 L (Aluminium)
                         Price: Rs. 899
				
			PRISTINE, Manufacturers of a range of Gourmet Cookware carries an experience of over two decades & has been successfully exporting to The Americas, Europe, Australia. The organization is ISO Certified having state of the art manufacturing facility spread over an area of 1,50,000 sq.feet.All products are manufactured with precise workmanship & pass through stringent quality control tests & checks. We deliver Quality products to our customers at factory prices. All products are packed in attractive gift boxes making it an ideal gifting solution as well.Our efforts are towards making the Kitchen a smarter place enhancing convenience, reduce time spent & reflect modern lifestyles.Our Mission: �To provide Quality Products at Affordable Prices.�
PRISTINE, Manufacturers of a range of Gourmet Cookware carries an experience of over two decades & has been successfully exporting to The Americas, Europe, Australia. The organization is ISO Certified having state of the art manufacturing facility spread over an area of 1,50,000 sq.feet.All products are manufactured with precise workmanship & pass through stringent quality control tests & checks. We deliver Quality products to our customers at factory prices. All products are packed in attractive gift boxes making it an ideal gifting solution as well.Our efforts are towards making the Kitchen a smarter place enhancing convenience, reduce time spent & reflect modern lifestyles.Our Mission: �To provide Quality Products at Affordable Prices.�"
262,Home Decor & Festive Needs,Shoppingtara Marble Elephant Pair Showpiece  -  5 cm,Buy Shoppingtara Marble Elephant Pair Showpiece  -  5 cm for Rs.589 online. Shoppingtara Marble Elephant Pair Showpiece  -  5 cm at best prices with FREE shipping & cash on delivery. Only Genuine Products. 30 Day Replacement Guarantee.
263,Home Decor & Festive Needs,Woodino Handicrafts Showpiece  -  6.5 cm,Buy Woodino Handicrafts Showpiece  -  6.5 cm for Rs.399 online. Woodino Handicrafts Showpiece  -  6.5 cm at best prices with FREE shipping & cash on delivery. Only Genuine Products. 30 Day Replacement Guarantee.
264,Home Decor & Festive Needs,Unique Handicrafts Inlaid Marble Box Showpiece  -  4.5 cm,"Unique Handicrafts Inlaid Marble Box Showpiece  -  4.5 cm (Stoneware, Blue)
                         Price: Rs. 1,200
				
			White Marble Box Inlaid With Semi Precious Stones
White Marble Box Inlaid With Semi Precious Stones"
265,Home Decor & Festive Needs,Lal Haveli Rajasthani Handmade Vintage Wooden Camel Design Jharoka Photo Frame Showpiece  -  43.18 cm,"Lal Haveli Rajasthani Handmade Vintage Wooden Camel Design Jharoka Photo Frame Showpiece  -  43.18 cm (Wooden, Copper)
                         Price: Rs. 1,499
				
			This traditional Rajasthani designer jharokha has been carved out of wood and symbolizes the exquisite skill of the craftsman. The beautiful gold patterns that adorn the artwork give it an intense royal look and make it a perfect gift item for any occasion or even for enhancing your home decor.
This traditional Rajasthani designer jharokha has been carved out of wood and symbolizes the exquisite skill of the craftsman. The beautiful gold patterns that adorn the artwork give it an intense royal look and make it a perfect gift item for any occasion or even for enhancing your home decor."
266,Kitchen & Dining,Pigeon Kadhai 1.2 L,"Pigeon Kadhai 1.2 L (Aluminium, Glass, Non-stick)
                         Price: Rs. 899
				
			Italian Technology,Non-Stick Base,Strong, Sturdy, Stay-Cool, Heat Resistant Bakelite Handles For Easy Grip,.5 Layered Teflon Coating, Chemical Pfoa Free And Scratch Resistant, Metal Spoon Friendly
Italian Technology,Non-Stick Base,Strong, Sturdy, Stay-Cool, Heat Resistant Bakelite Handles For Easy Grip,.5 Layered Teflon Coating, Chemical Pfoa Free And Scratch Resistant, Metal Spoon Friendly"
267,Kitchen & Dining,Sahara Q Shop Kadhai 1.5 L,"Sahara Q Shop Kadhai 1.5 L (Stainless Steel)
                         Price: Rs. 650
				
			Premium Non Stick Kadhai 1.5.Ltr
Premium Non Stick Kadhai 1.5.Ltr"
268,Kitchen & Dining,Mom Italy Wheel Pizza Cutter,Buy Mom Italy Wheel Pizza Cutter for Rs.169 online. Mom Italy Wheel Pizza Cutter at best prices with FREE shipping & cash on delivery. Only Genuine Products. 30 Day Replacement Guarantee.
269,Home Decor & Festive Needs,Rajo Raja Mahavastu Buddha Artpiece Showpiece  -  20.5 cm,Buy Rajo Raja Mahavastu Buddha Artpiece Showpiece  -  20.5 cm for Rs.1799 online. Rajo Raja Mahavastu Buddha Artpiece Showpiece  -  20.5 cm at best prices with FREE shipping & cash on delivery. Only Genuine Products. 30 Day Replacement Guarantee.
270,Home Decor & Festive Needs,Mavi 237MBB Showpiece  -  15 cm,Buy Mavi 237MBB Showpiece  -  15 cm for Rs.1290 online. Mavi 237MBB Showpiece  -  15 cm at best prices with FREE shipping & cash on delivery. Only Genuine Products. 30 Day Replacement Guarantee.
271,Home Decor & Festive Needs,S C Handicrafts Showpiece  -  40 cm,Buy S C Handicrafts Showpiece  -  40 cm for Rs.8900 online. S C Handicrafts Showpiece  -  40 cm at best prices with FREE shipping & cash on delivery. Only Genuine Products. 30 Day Replacement Guarantee.
272,Home Decor & Festive Needs,Ruchikainternational ruc0013 Showpiece  -  13 cm,Buy Ruchikainternational ruc0013 Showpiece  -  13 cm for Rs.549 online. Ruchikainternational ruc0013 Showpiece  -  13 cm at best prices with FREE shipping & cash on delivery. Only Genuine Products. 30 Day Replacement Guarantee.
273,Kitchen & Dining,Ndura Kadhai 1.7 L,"Ndura Kadhai 1.7 L
                         Price: Rs. 654
				
			A fantastic addition to your kitchen, this silver coloured kadhai brought to you by Steel Factory is all set to ease up your cooking tasks. Finely crafted out of high quality stainless steel, this kadhai comes in mirror finish and looks very classy
A fantastic addition to your kitchen, this silver coloured kadhai brought to you by Steel Factory is all set to ease up your cooking tasks. Finely crafted out of high quality stainless steel, this kadhai comes in mirror finish and looks very classy"
274,Kitchen & Dining,Supreme Cookwares Kadhai 1.5 L,Buy Supreme Cookwares Kadhai 1.5 L for Rs.799 online. Supreme Cookwares Kadhai 1.5 L at best prices with FREE shipping & cash on delivery. Only Genuine Products. 30 Day Replacement Guarantee.
275,Baby Care,Babeezworld Baby Boy's Romper,"Key Features of Babeezworld Baby Boy's Romper Fabric: Cotton Brand Color: Blue:Green,Babeezworld Baby Boy's Romper Price: Rs. 499 Babeezworld presents a cute baby dungaree set for your little one.This dungaree set comes with a trendy round neck cotton t-shirt with shoulder loops for ease and comfort fit. Set is made of soft cotton material and has adjustable straps with two button closures. The front has a special character which gives it a stylish look. This dungaree set is an ideal pick for this summer and is available in multiple colors.,Specifications of Babeezworld Baby Boy's Romper Top Details Sleeve Half Sleeve Number of Contents in Sales Package Pack of 2 Fabric Cotton Type Romper Neck Round Neck General Details Pattern Printed Ideal For Baby Boy's Fabric Care Wash with Similar Colors, Use Detergent for Colors"
276,Watches,Pittsburgh Polo Club PBPC-505-GRN Analog Watch  - For Men,Specifications of Pittsburgh Polo Club PBPC-505-GRN Analog Watch  - For Men Functions Chronograph No Altimeter No Barometer No Calendar No Luminous No General Mechanism Quartz Type Analog Style Code PBPC-505-GRN Occasion Casual Ideal For Men Power Source Battery Powered Warranty 6 month manufacturer warranty Body Features Box Material Cardboard Dial Shape Round Strap Type Bracelet Strap Color Green Shock Resistance No Scratch Resistant No Water Resistant No Clasp Type Buckle Dial Color Green
277,Watches,"palito PLO 169 Analog Watch  - For Girls, Women","Key Features of palito PLO 169 Analog Watch  - For Girls, Women Dial Color: red Dial Shape: Round Strap Color: red,Specifications of palito PLO 169 Analog Watch  - For Girls, Women General Type Analog Style Code PLO 169 Occasion Formal Ideal For Girls, Women Warranty 6 months Body Features Dial Shape Round Strap Color red Dial Color red"
278,Watches,Adino ADF04 Analog Watch  - For Girls,"Specifications of Adino ADF04 Analog Watch  - For Girls General Type Analog Style Code ADF04 Ideal For Girls Occasion Party-Wedding Warranty 3 Month Body Features Dial Shape Round Strap Color Steel Dial Color Black, Pink, Green, Purpal"
279,Watches,ESIDON AKADA06 Analog Watch  - For Women,Specifications of ESIDON AKADA06 Analog Watch  - For Women General Type Analog Style Code AKADA06 Ideal For Women Occasion Party-Wedding Warranty 3-month Body Features Dial Shape Round Strap Color Gold Dial Color White
280,Watches,"palito PLO 166 Analog Watch  - For Girls, Women","Specifications of palito PLO 166 Analog Watch  - For Girls, Women General Type Analog Style Code PLO 166 Ideal For Girls, Women Occasion Party-Wedding Warranty 6 months Body Features Dial Shape Round Strap Color black Dial Color black"
281,Home Furnishing,Bhavya Velvet Sofa Cover,"Bhavya Velvet Sofa Cover (Grey Pack of 10) Price: Rs. 1,999 Bhavya Velvet Sofa Cover (Black Pack of 10),Specifications of Bhavya Velvet Sofa Cover (Grey Pack of 10) In the Box Pack of 10 General Brand Bhavya Model Number 10BTSC2012Gb Shade Grey Color Black Type Sofa Pattern Floral Material Velvet Suitable For Living-Room Dimensions Width 58.4 cm Height 69 cm Weight 1 kg"
282,Baby Care,cherry crumble california Baby Boy's Dungaree,"Key Features of cherry crumble california Baby Boy's Dungaree Fabric: 100% Cotton Brand Color: Grey Olive Camouflage,Specifications of cherry crumble california Baby Boy's Dungaree Top Details Fabric 100% Cotton Type Dungaree General Details Pattern Printed Ideal For Baby Boy's"
283,Watches,Yves Bertelin YBSCR557 Analog Watch  - For Women,"Specifications of Yves Bertelin YBSCR557 Analog Watch  - For Women General Mechanism Quartz Type Analog Style Code YBSCR557 Ideal For Women Occasion Party-Wedding Power Source Battery Powered Warranty 6 month plating, 1 yrs Warranty for movement & battery In the Box Watch, Warranty Card, Box Body Features Dial Shape Round Box Material Wooden Strap Color Multi Dial Color White Strap Material Ceramic Strap"
284,Home Decor & Festive Needs,Services Junction Beautiful Black and Golden color Diamond Ganesh idol for Pooja Showpiece  -  5 cm,"Key Features of Services Junction Beautiful Black and Golden color Diamond Ganesh idol for Pooja Showpiece  -  5 cm Lord Ganesha | Ganesh | Ganpati by Gods & Gifts (G0004gld); Material:- Clay; Package Contents:- 1 Statue; Packaging:- Box Packed and Bubble Wrapped; Dimensions : 5cms x 4.5cms x 2.5cms  (approx.) Care Instructions: - Clean with Damp Cloth, Do not Submerge in Water.,Services Junction Beautiful Black and Golden color Diamond Ganesh idol for Pooja Showpiece  -  5 cm (Pottery, Black, Gold, Silver) Price: Rs. 1,249 ""Exclusive antique finish Black Ganesh Idol made with Clay and given a unique finish with Golden Diamond like stones studded. Limited edition pieces Available for gifting as well as for placing in home. Speciality: • Very rich and attractive • Limited Edition Item. Ganesh, Deity of Hinduism, Deva of Wisdom and Intellect, Handmade stone and fine painted Statue, Colorful Stone Ganesha with Very famous Meenakari, Hand painting. Gorgeous & Unique Ganesha Ganpati Bring prosperity and happiness in your home & Office, Perfect at Pooja Place, Desk , Home decor or as a beautiful Spiritual Gift. Disclaimer: The images represent actual product though color of the image and product may slightly differ. "",Specifications of Services Junction Beautiful Black and Golden color Diamond Ganesh idol for Pooja Showpiece  -  5 cm (Pottery, Black, Gold, Silver) General Brand Services Junction Model Number G00004gld_blk Type Contemporary, Religious Idols, Antique Shade Black, Golden, Silver Material Pottery Model Name Beautiful Black and Golden color Diamond Ganesh idol for Pooja Color Black, Gold, Silver Dimensions Weight 50 g Height 5 cm Width 4.5 cm Depth 2.5 cm Additional Features Other Features Lord Ganesha | Ganesh | Ganpati by Gods & Gifts (G0004gld);, Material:- Clay;, Package Contents:- 1 Statue;, Packaging:- Box Packed and Bubble Wrapped;, Dimensions : 5cms x 4.5cms x 2.5cms (approx.), Care Instructions: - Clean with Damp Cloth, Do not Submerge in Water. In the Box Sales Package 1 Ganesha Idol Pack of 1"
285,Watches,"palito PLO 149 Analog Watch  - For Girls, Women","Specifications of palito PLO 149 Analog Watch  - For Girls, Women General Type Analog Style Code PLO 149 Ideal For Girls, Women Occasion Party-Wedding Warranty 6 months Body Features Dial Shape Round Strap Color black Dial Color black"
286,Watches,V9 METAL STRAP Analog Watch  - For Men,Specifications of V9 METAL STRAP Analog Watch  - For Men General Type Analog Style Code METAL STRAP Occasion Casual Ideal For Men Warranty NO Body Features Dial Shape Round Strap Color STEEL Dial Color BLACK
287,Home Furnishing,Dreamshomes Velvet Sofa Cover,Specifications of Dreamshomes Velvet Sofa Cover (Multicolour Pack of 6) In the Box Pack of 6 General Brand Dreamshomes Model Number SOFAB002 Shade Multicolour Color Multicolor Type Sofa Pattern Checkered Material Velvet Suitable For Living-Room Dimensions Height 36 cm Weight 1 kg
288,Baby Care,"Kandyfloss Baby Boy's, Baby Girl's Romper","Key Features of Kandyfloss Baby Boy's, Baby Girl's Romper Fabric: COTTON Brand Color: RED,Specifications of Kandyfloss Baby Boy's, Baby Girl's Romper Top Details Number of Contents in Sales Package Pack of 3 Fabric COTTON Type Romper Neck ENVELOPE NECK General Details Pattern Geometric Print Ideal For Baby Boy's, Baby Girl's In the Box 3 Romper"
289,Home Decor & Festive Needs,Services Junction Gold Plated Ganesh Idol Showpiece For Pooja Showpiece  -  6.5 cm,"Key Features of Services Junction Gold Plated Ganesh Idol Showpiece For Pooja Showpiece  -  6.5 cm Lord Ganesha | Ganesh | Ganpati by Gods & Gifts (G0015GId); Material:- Clay; Package Contents:- 1 Statue; Packaging:- Box Packed and Bubble Wrapped; Dimensions : 6.5cms x 3.5cms x 3cms  (approx.) Care Instructions: - Clean with Damp Cloth, Do not Submerge in Water.,Services Junction Gold Plated Ganesh Idol Showpiece For Pooja Showpiece  -  6.5 cm (Pottery, Gold) Price: Rs. 1,689 ""Hard to find Unique Posters With Gold Finish. Huge Collection consisting of your favorite gods and goddesses. This brass idol of God Ganesha is meant for performing puja at home, or for simply decorating your home in Hindu way. evotion to Ganesha is widely diffused and extends to Jains, Buddhists, and beyond India. Although he is known by many attributes, Ganesha's elephant head makes him easy to identify. Ganesha is widely revered as the remover of obstacles, the patron of arts and sciences and the deva of intellect and wisdom. As the god of beginnings, he is honoured at the start of rituals and ceremonies.Disclaimer: The images represent actual product though color of the image and product may slightly differ. "",Specifications of Services Junction Gold Plated Ganesh Idol Showpiece For Pooja Showpiece  -  6.5 cm (Pottery, Gold) General Brand Services Junction Model Number G0015Gld_PL Shade Golden Type Contemporary, Religious Idols, Antique Model Name Gold Plated Ganesh Idol Showpiece For Pooja Material Pottery Color Gold Dimensions Weight 50 g Height 6.5 cm Width 3.5 cm Depth 3 cm In the Box Sales Package 1 Ganesha Idol Pack of 1 Additional Features Other Features Lord Ganesha | Ganesh | Ganpati by Gods & Gifts (G0015GId);, Material:- Clay;, Package Contents:- 1 Statue;, Packaging:- Box Packed and Bubble Wrapped;, Dimensions : 6.5cms x 3.5cms x 3cms (approx.), Care Instructions: - Clean with Damp Cloth, Do not Submerge in Water. Water Resistant No"
