product_category_tree,product_name,description
495,Watches,Sonata 7007YL08 Watch,"Sonata 7007YL08 Watch - Buy Sonata 7007YL08 Watch  7007YL08 Online at Rs.849 in India Only at Flipkart.com. - Great Discounts, Only Genuine Products, 30 Day Replacement Guarantee, Free Shipping. Cash On Delivery!"
496,Watches,Sonata 7016YM04 Watch,"Sonata 7016YM04 Watch - Buy Sonata 7016YM04 Watch  7016YM04 Online at Rs.789 in India Only at Flipkart.com. - Great Discounts, Only Genuine Products, 30 Day Replacement Guarantee, Free Shipping. Cash On Delivery!"
497,Watches,Times 284TMS284 Party-Wedding Analog Watch  - For Women,"Times 284TMS284 Party-Wedding Analog Watch  - For Women - Buy Times 284TMS284 Party-Wedding Analog Watch  - For Women  284TMS284 Online at Rs.550 in India Only at Flipkart.com. - Great Discounts, Only Genuine Products, 30 Day Replacement Guarantee, Free Shipping. Cash On Delivery!"
498,Watches,"Times Times_51 Party-Wedding Analog Watch  - For Women, Girls","Times Times_51 Party-Wedding Analog Watch  - For Women, Girls
                         Price: Rs. 599
				
			Times Wedding Analog Pink Dial Women's Watch
Times Wedding Analog Pink Dial Women's Watch"
499,Watches,Maxima 03918CMLY Analog Watch  - For Women,"Maxima 03918CMLY Analog Watch  - For Women - Buy Maxima 03918CMLY Analog Watch  - For Women  03918CMLY Online at Rs.795 in India Only at Flipkart.com. Stainless Steel Back Case, Water Resistant, Deployment Clasp, Golden Strap, Round Dial - Great Discounts, Only Genuine Products, 30 Day Replacement Guarantee, Free Shipping. Cash On Delivery!"
500,Watches,Nexus NX_7668 Analog Watch  - For Men,"Nexus NX_7668 Analog Watch  - For Men - Buy Nexus NX_7668 Analog Watch  - For Men  NX_7668 Online at Rs.999 in India Only at Flipkart.com. - Great Discounts, Only Genuine Products, 30 Day Replacement Guarantee, Free Shipping. Cash On Delivery!"
501,Watches,Sonata 8959YL01 Yuva Gold Analog Watch  - For Women,"Sonata 8959YL01 Yuva Gold Analog Watch  - For Women - Buy Sonata 8959YL01 Yuva Gold Analog Watch  - For Women  8959YL01 Online at Rs.780 in India Only at Flipkart.com. Round Dial, White and Teal Strap, Water Resistant - Great Discounts, Only Genuine Products, 30 Day Replacement Guarantee, Free Shipping. Cash On Delivery!"
502,Watches,Maxima 01433CMGY Gold Analog Watch  - For Men,"Maxima 01433CMGY Gold Analog Watch  - For Men - Buy Maxima 01433CMGY Gold Analog Watch  - For Men  01433CMGY Online at Rs.795 in India Only at Flipkart.com. Water Resistant, Brass Case, Golden Strap, Round Dial - Great Discounts, Only Genuine Products, 30 Day Replacement Guarantee, Free Shipping. Cash On Delivery!"
503,Watches,Sonata 77036SM02J Watch,"Sonata 77036SM02J Watch - Buy Sonata 77036SM02J Watch  77036SM02J Online at Rs.999 in India Only at Flipkart.com. - Great Discounts, Only Genuine Products, 30 Day Replacement Guarantee, Free Shipping. Cash On Delivery!"
504,Computers,Lapguard HP Pavilion dv5-1008ax 6 Cell Laptop Battery,Buy Lapguard HP Pavilion dv5-1008ax 6 Cell Laptop Battery only for Rs. 0.0 from Flipkart.com. Only Genuine Products. 30 Day Replacement Guarantee. Free Shipping. Cash On Delivery!
505,Watches,Maxima 24990LMLI Swarovski Analog Watch  - For Women,"Maxima 24990LMLI Swarovski Analog Watch  - For Women - Buy Maxima 24990LMLI Swarovski Analog Watch  - For Women  24990LMLI Online at Rs.760 in India Only at Flipkart.com. Round Dial, Buckle Clasp, Water Resistant, Black Strap - Great Discounts, Only Genuine Products, 30 Day Replacement Guarantee, Free Shipping. Cash On Delivery!"
506,Computers,Rega IT Gateway MD7822 MD-7822 MD7822U 6 Cell Laptop Battery,Buy Rega IT Gateway MD7822 MD-7822 MD7822U 6 Cell Laptop Battery only for Rs. 1299 from Flipkart.com. Only Genuine Products. 30 Day Replacement Guarantee. Free Shipping. Cash On Delivery!
507,Computers,Rega IT Hp Pavilion DV2535TX DV2536TX 12 Cell 12 Cell Laptop Battery,"Rega IT Hp Pavilion DV2535TX DV2536TX 12 Cell 12 Cell Laptop Battery
                         Price: Rs. 2,499
				
			Rega IT Replacement 12 Cell (Extended) Laptop Battery for Hp Pavilion DV2535TX DV2536TX Laptop Made from highest quality parts each Rega IT replacement Battery confirms to specifications similar and guaranteed to meet or exceed your laptop's minimum requirements. Each Battery also passes necessary authentication certifications like CE, ROHS etc. Before leaving the factory, so you can be rest assured for its quality, durability and performance. Please make sure that you are selecting the correct Battery as per you old Battery specification. Please compare your old Battery Power Rating i.e. Volts (V), Capacity (mAh) & Cells.
Rega IT Replacement 12 Cell (Extended) Laptop Battery for Hp Pavilion DV2535TX DV2536TX Laptop Made from highest quality parts each Rega IT replacement Battery confirms to specifications similar and guaranteed to meet or exceed your laptop's minimum requirements. Each Battery also passes necessary authentication certifications like CE, ROHS etc. Before leaving the factory, so you can be rest assured for its quality, durability and performance. Please make sure that you are selecting the correct Battery as per you old Battery specification. Please compare your old Battery Power Rating i.e. Volts (V), Capacity (mAh) & Cells."
508,Computers,Lapguard HP Pavilion dv5-1015nr 6 Cell Laptop Battery,Buy Lapguard HP Pavilion dv5-1015nr 6 Cell Laptop Battery only for Rs. 0.0 from Flipkart.com. Only Genuine Products. 30 Day Replacement Guarantee. Free Shipping. Cash On Delivery!
509,Watches,Maxima 17321CMLY Gold Analog Watch  - For Women,"Maxima 17321CMLY Gold Analog Watch  - For Women - Buy Maxima 17321CMLY Gold Analog Watch  - For Women  17321CMLY Online at Rs.675 in India Only at Flipkart.com. Golden Strap, Water Resistant, Round Dial, Brass Case, Deployment Clasp - Great Discounts, Only Genuine Products, 30 Day Replacement Guarantee, Free Shipping. Cash On Delivery!"
510,Watches,Logues LGSWATCHES760SL Analog Watch  - For Women,"Logues LGSWATCHES760SL Analog Watch  - For Women - Buy Logues LGSWATCHES760SL Analog Watch  - For Women  LGSWATCHES760SL Online at Rs.725 in India Only at Flipkart.com. - Great Discounts, Only Genuine Products, 30 Day Replacement Guarantee, Free Shipping. Cash On Delivery!"
511,Computers,Lapguard HP Pavilion dv5-1014tx 6 Cell Laptop Battery,Buy Lapguard HP Pavilion dv5-1014tx 6 Cell Laptop Battery only for Rs. 0.0 from Flipkart.com. Only Genuine Products. 30 Day Replacement Guarantee. Free Shipping. Cash On Delivery!
512,Computers,Lapguard HP Pavilion dv5-1020el 6 Cell Laptop Battery,"Lapguard HP Pavilion dv5-1020el 6 Cell Laptop Battery
                         Price: Rs. 1,699
				
			This Lapguard replacement battery is made from high grade cells and highest quality parts. This lapguard brand replacement battery is 100 percent comparable to original battery in all terms including its size, appearance and most important quality. Each lapguard laptop battery has to pass strict quality control procedures including filtration and safety testing of voltage, capacity and battery core (body). Each battery also passes necessary authentication certifications like CE, ROHS etc. Before leaving the factory, so you can be rest assured for its quality, durability and performance.
This Lapguard replacement battery is made from high grade cells and highest quality parts. This lapguard brand replacement battery is 100 percent comparable to original battery in all terms including its size, appearance and most important quality. Each lapguard laptop battery has to pass strict quality control procedures including filtration and safety testing of voltage, capacity and battery core (body). Each battery also passes necessary authentication certifications like CE, ROHS etc. Before leaving the factory, so you can be rest assured for its quality, durability and performance."
513,Watches,Global Nomad GNLBBL0314 Analog Watch  - For Men,"Global Nomad GNLBBL0314 Analog Watch  - For Men - Buy Global Nomad GNLBBL0314 Analog Watch  - For Men  GNLBBL0314 Online at Rs.725 in India Only at Flipkart.com. Round Dial, Black Strap, Water Resistant, Stainless Steel Back Case, Buckle Clasp - Great Discounts, Only Genuine Products, 30 Day Replacement Guarantee, Free Shipping. Cash On Delivery!"
514,Watches,Maxima 04615CMGY Gold Analog Watch  - For Men,"Maxima 04615CMGY Gold Analog Watch  - For Men - Buy Maxima 04615CMGY Gold Analog Watch  - For Men  04615CMGY Online at Rs.795 in India Only at Flipkart.com. Round Dial, Golden Strap, Brass Case, Water Resistant - Great Discounts, Only Genuine Products, 30 Day Replacement Guarantee, Free Shipping. Cash On Delivery!"
515,Watches,"Noise NOSWW032 I M Famous Analog Watch  - For Women, Men","Noise NOSWW032 I M Famous Analog Watch  - For Women, Men - Buy Noise NOSWW032 I M Famous Analog Watch  - For Women, Men  NOSWW032 Online at Rs.999 in India Only at Flipkart.com. Buckle Clasp, Round Dial, Sky Blue Strap - Great Discounts, Only Genuine Products, 30 Day Replacement Guarantee, Free Shipping. Cash On Delivery!"
516,Watches,Sonata 7016YM09 Watch,"Sonata 7016YM09 Watch - Buy Sonata 7016YM09 Watch  7016YM09 Online at Rs.968 in India Only at Flipkart.com. - Great Discounts, Only Genuine Products, 30 Day Replacement Guarantee, Free Shipping. Cash On Delivery!"
517,Watches,Sonata 87001SL01 Analog Watch  - For Women,"Sonata 87001SL01 Analog Watch  - For Women - Buy Sonata 87001SL01 Analog Watch  - For Women  87001SL01 Online at Rs.899 in India Only at Flipkart.com. Contemporary Dial, White Strap, Water Resistant - Great Discounts, Only Genuine Products, 30 Day Replacement Guarantee, Free Shipping. Cash On Delivery!"
518,Watches,Maxima 23952LMLI Swarovski Analog Watch  - For Women,"Maxima 23952LMLI Swarovski Analog Watch  - For Women - Buy Maxima 23952LMLI Swarovski Analog Watch  - For Women  23952LMLI Online at Rs.895 in India Only at Flipkart.com. Rectangular Dial, Buckle Clasp, Pink Strap, Brass Case, Water Resistant - Great Discounts, Only Genuine Products, 30 Day Replacement Guarantee, Free Shipping. Cash On Delivery!"
519,Watches,Maxima 21131CPGI Mac Attivo Analog Watch  - For Men,"Maxima 21131CPGI Mac Attivo Analog Watch  - For Men - Buy Maxima 21131CPGI Mac Attivo Analog Watch  - For Men  21131CPGI Online at Rs.695 in India Only at Flipkart.com. Water Resistant, Rectangle Dial, Silver Strap - Great Discounts, Only Genuine Products, 30 Day Replacement Guarantee, Free Shipping. Cash On Delivery!"
520,Watches,Maxima 29923LPGY Analog Watch  - For Men,"Maxima 29923LPGY Analog Watch  - For Men - Buy Maxima 29923LPGY Analog Watch  - For Men  29923LPGY Online at Rs.800 in India Only at Flipkart.com. Stainless Steel Back Case, Brown Strap, Water Resistant, Buckle Clasp, Round Dial - Great Discounts, Only Genuine Products, 30 Day Replacement Guarantee, Free Shipping. Cash On Delivery!"
521,Watches,Maxima 20981LMGI Attivo Analog Watch  - For Men,"Maxima 20981LMGI Attivo Analog Watch  - For Men - Buy Maxima 20981LMGI Attivo Analog Watch  - For Men  20981LMGI Online at Rs.895 in India Only at Flipkart.com. Round Dial, Buckle Clasp, Black Strap, Brass Case, Water Resistant - Great Discounts, Only Genuine Products, 30 Day Replacement Guarantee, Free Shipping. Cash On Delivery!"
522,Watches,Maxima 24742LMGY Gold Analog Watch  - For Men,"Maxima 24742LMGY Gold Analog Watch  - For Men - Buy Maxima 24742LMGY Gold Analog Watch  - For Men  24742LMGY Online at Rs.950 in India Only at Flipkart.com. Black Strap, Water Resistant, Round Dial - Great Discounts, Only Genuine Products, 30 Day Replacement Guarantee, Free Shipping. Cash On Delivery!"
523,Watches,Maxima 09321CMGY Gold Analog Watch  - For Men,"Maxima 09321CMGY Gold Analog Watch  - For Men - Buy Maxima 09321CMGY Gold Analog Watch  - For Men  09321CMGY Online at Rs.880 in India Only at Flipkart.com. Tonneau Dial, Golden Strap, Water Resistant, Brass Case - Great Discounts, Only Genuine Products, 30 Day Replacement Guarantee, Free Shipping. Cash On Delivery!"
524,Watches,"Noise NOSWW001 Analog Watch  - For Men, Women","Noise NOSWW001 Analog Watch  - For Men, Women - Buy Noise NOSWW001 Analog Watch  - For Men, Women  NOSWW001 Online at Rs.999 in India Only at Flipkart.com. Round Dial, Blue Strap, Water Resistant - Great Discounts, Only Genuine Products, 30 Day Replacement Guarantee, Free Shipping. Cash On Delivery!"
525,Watches,SF by Sonata 7991PP02 Ocean Digital Watch  - For Men,"SF by Sonata 7991PP02 Ocean Digital Watch  - For Men - Buy SF by Sonata 7991PP02 Ocean Digital Watch  - For Men  7991PP02 Online at Rs.999 in India Only at Flipkart.com. Water Resistant, Round Dial, Black Strap - Great Discounts, Only Genuine Products, 30 Day Replacement Guarantee, Free Shipping. Cash On Delivery!"
526,Watches,Fluid FU203-GR01 Analog-Digital Watch  - For Men,"Fluid FU203-GR01 Analog-Digital Watch  - For Men - Buy Fluid FU203-GR01 Analog-Digital Watch  - For Men  FU203-GR01 Online at Rs.899 in India Only at Flipkart.com. Rectangular Dial, Green Strap, Water Resistant - Great Discounts, Only Genuine Products, 30 Day Replacement Guarantee, Free Shipping. Cash On Delivery!"
527,Watches,Maxima 06362CMGY Gold Analog Watch  - For Men,"Maxima 06362CMGY Gold Analog Watch  - For Men - Buy Maxima 06362CMGY Gold Analog Watch  - For Men  06362CMGY Online at Rs.995 in India Only at Flipkart.com. Water Resistant, Round Dial, Deployment Clasp, Golden Strap - Great Discounts, Only Genuine Products, 30 Day Replacement Guarantee, Free Shipping. Cash On Delivery!"
528,Watches,Sonata 8944SL03 Analog Watch  - For Women,"Sonata 8944SL03 Analog Watch  - For Women - Buy Sonata 8944SL03 Analog Watch  - For Women  8944SL03 Online at Rs.770 in India Only at Flipkart.com. Round Dial, Buckle Clasp, Pink Strap, Water Resistant, Stainless Steel Back Case - Great Discounts, Only Genuine Products, 30 Day Replacement Guarantee, Free Shipping. Cash On Delivery!"
529,Watches,Times 317TMS317 Party-Wedding Analog Watch  - For Men,"Times 317TMS317 Party-Wedding Analog Watch  - For Men - Buy Times 317TMS317 Party-Wedding Analog Watch  - For Men  317TMS317 Online at Rs.550 in India Only at Flipkart.com. - Great Discounts, Only Genuine Products, 30 Day Replacement Guarantee, Free Shipping. Cash On Delivery!"
530,Watches,Maxima 12011PPGW Analog Watch  - For Men,"Maxima 12011PPGW Analog Watch  - For Men - Buy Maxima 12011PPGW Analog Watch  - For Men  12011PPGW Online at Rs.593 in India Only at Flipkart.com. Round Dial, Black Strap, Stainless Steel Back Case, Buckle Clasp, Water Resistant - Great Discounts, Only Genuine Products, 30 Day Replacement Guarantee, Free Shipping. Cash On Delivery!"
531,Watches,Times 333TMS333 Party-Wedding Analog Watch  - For Women,"Times 333TMS333 Party-Wedding Analog Watch  - For Women - Buy Times 333TMS333 Party-Wedding Analog Watch  - For Women  333TMS333 Online at Rs.599 in India Only at Flipkart.com. - Great Discounts, Only Genuine Products, 30 Day Replacement Guarantee, Free Shipping. Cash On Delivery!"
532,Watches,HMT HMTWHQ Analog Watch  - For Men,"HMT HMTWHQ Analog Watch  - For Men - Buy HMT HMTWHQ Analog Watch  - For Men  HMTWHQ Online at Rs.999 in India Only at Flipkart.com. - Great Discounts, Only Genuine Products, 30 Day Replacement Guarantee, Free Shipping. Cash On Delivery!"
533,Watches,Sonata 1141YM22 Analog Watch  - For Men,"Sonata 1141YM22 Analog Watch  - For Men - Buy Sonata 1141YM22 Analog Watch  - For Men  1141YM22 Online at Rs.949 in India Only at Flipkart.com. Round Dial, Water Resistant, Golden Strap, Deployment Clasp - Great Discounts, Only Genuine Products, 30 Day Replacement Guarantee, Free Shipping. Cash On Delivery!"
534,Watches,Timewel 1100-N1685 Analog Watch  - For Men,"Timewel 1100-N1685 Analog Watch  - For Men - Buy Timewel 1100-N1685 Analog Watch  - For Men  1100-N1685 Online at Rs.745 in India Only at Flipkart.com. - Great Discounts, Only Genuine Products, 30 Day Replacement Guarantee, Free Shipping. Cash On Delivery!"
535,Watches,Maxima 24864LMGY Analog Watch  - For Men,"Maxima 24864LMGY Analog Watch  - For Men - Buy Maxima 24864LMGY Analog Watch  - For Men  24864LMGY Online at Rs.950 in India Only at Flipkart.com. Water Resistant, Stainless Steel Back Case, Buckle Clasp, Black Strap, Round Dial - Great Discounts, Only Genuine Products, 30 Day Replacement Guarantee, Free Shipping. Cash On Delivery!"
536,Watches,Times 280TMS280 Party-Wedding Analog Watch  - For Women,"Times 280TMS280 Party-Wedding Analog Watch  - For Women - Buy Times 280TMS280 Party-Wedding Analog Watch  - For Women  280TMS280 Online at Rs.550 in India Only at Flipkart.com. - Great Discounts, Only Genuine Products, 30 Day Replacement Guarantee, Free Shipping. Cash On Delivery!"
537,Watches,Maxima 01784BMLY Gold Analog Watch  - For Women,"Maxima 01784BMLY Gold Analog Watch  - For Women - Buy Maxima 01784BMLY Gold Analog Watch  - For Women  01784BMLY Online at Rs.995 in India Only at Flipkart.com. Golden Strap, Brass Case, Oval Dial, Water Resistant - Great Discounts, Only Genuine Products, 30 Day Replacement Guarantee, Free Shipping. Cash On Delivery!"
538,Watches,Sonata 7092SL01 Yuva Analog Watch  - For Men,"Sonata 7092SL01 Yuva Analog Watch  - For Men - Buy Sonata 7092SL01 Yuva Analog Watch  - For Men  7092SL01 Online at Rs.999 in India Only at Flipkart.com. Contemporary Dial, Black Strap, Stainless Steel Back Case, Water Resistant, Buckle Clasp - Great Discounts, Only Genuine Products, 30 Day Replacement Guarantee, Free Shipping. Cash On Delivery!"
539,Watches,Maxima 26512PPGN FIBER COLLECTION Analog Watch  - For Men,"Maxima 26512PPGN FIBER COLLECTION Analog Watch  - For Men - Buy Maxima 26512PPGN FIBER COLLECTION Analog Watch  - For Men  26512PPGN Online at Rs.595 in India Only at Flipkart.com. Round Dial, Black Strap, Stainless Steel Back Case, Water Resistant, Buckle Clasp - Great Discounts, Only Genuine Products, 30 Day Replacement Guarantee, Free Shipping. Cash On Delivery!"
540,Watches,Times 109B0109 Sports Analog Watch  - For Boys,"Times 109B0109 Sports Analog Watch  - For Boys - Buy Times 109B0109 Sports Analog Watch  - For Boys  109B0109 Online at Rs.695 in India Only at Flipkart.com. - Great Discounts, Only Genuine Products, 30 Day Replacement Guarantee, Free Shipping. Cash On Delivery!"
541,Watches,Petrol PCWBL68 Analog Watch  - For Men,"Petrol PCWBL68 Analog Watch  - For Men - Buy Petrol PCWBL68 Analog Watch  - For Men  PCWBL68 Online at Rs.999 in India Only at Flipkart.com. Round Dial, Black Strap, Water Resistant, Stainless Steel Back Case - Great Discounts, Only Genuine Products, 30 Day Replacement Guarantee, Free Shipping. Cash On Delivery!"
542,Watches,Maxima 01741LPLN Analog Watch  - For Women,"Maxima 01741LPLN Analog Watch  - For Women - Buy Maxima 01741LPLN Analog Watch  - For Women  01741LPLN Online at Rs.650 in India Only at Flipkart.com. Buckle Clasp, Oval Dial, Black Strap, Water Resistant - Great Discounts, Only Genuine Products, 30 Day Replacement Guarantee, Free Shipping. Cash On Delivery!"
543,Watches,Sonata 7052YM07 Watch,"Sonata 7052YM07 Watch - Buy Sonata 7052YM07 Watch  7052YM07 Online at Rs.869 in India Only at Flipkart.com. - Great Discounts, Only Genuine Products, 30 Day Replacement Guarantee, Free Shipping. Cash On Delivery!"
544,Watches,"Only Kidz 20600 Digital Watch  - For Boys, Girls","Only Kidz 20600 Digital Watch  - For Boys, Girls - Buy Only Kidz 20600 Digital Watch  - For Boys, Girls  20600 Online at Rs.599 in India Only at Flipkart.com. Round Dial, Buckle Clasp, Blue and Red Strap - Great Discounts, Only Genuine Products, 30 Day Replacement Guarantee, Free Shipping. Cash On Delivery!"
545,Watches,"Kool Kidz DMK-011-PK 01 Analog Watch  - For Boys, Girls","Kool Kidz DMK-011-PK 01 Analog Watch  - For Boys, Girls - Buy Kool Kidz DMK-011-PK 01 Analog Watch  - For Boys, Girls  DMK-011-PK 01 Online at Rs.476 in India Only at Flipkart.com. Multi-color Strap, Round Dial, Metal Case - Great Discounts, Only Genuine Products, 30 Day Replacement Guarantee, Free Shipping. Cash On Delivery!"
546,Watches,Maxima 19431CMGY Gold Analog Watch  - For Men,"Maxima 19431CMGY Gold Analog Watch  - For Men - Buy Maxima 19431CMGY Gold Analog Watch  - For Men  19431CMGY Online at Rs.795 in India Only at Flipkart.com. Golden Strap, Brass Case, Round Dial, Water Resistant - Great Discounts, Only Genuine Products, 30 Day Replacement Guarantee, Free Shipping. Cash On Delivery!"
547,Watches,Maxima 01727LPLN Mac Gold Analog Watch  - For Women,"Maxima 01727LPLN Mac Gold Analog Watch  - For Women - Buy Maxima 01727LPLN Mac Gold Analog Watch  - For Women  01727LPLN Online at Rs.650 in India Only at Flipkart.com. Plastic Case, Brass Bezel, Buckle Clasp, Water Resistant, Oval Dial, Black Strap - Great Discounts, Only Genuine Products, 30 Day Replacement Guarantee, Free Shipping. Cash On Delivery!"
548,Watches,Timewel 1100-N145 Analog Watch  - For Men,"Timewel 1100-N145 Analog Watch  - For Men - Buy Timewel 1100-N145 Analog Watch  - For Men  1100-N145 Online at Rs.915 in India Only at Flipkart.com. - Great Discounts, Only Genuine Products, 30 Day Replacement Guarantee, Free Shipping. Cash On Delivery!"
549,Watches,HMT S3648 Analog Watch  - For Men,"HMT S3648 Analog Watch  - For Men - Buy HMT S3648 Analog Watch  - For Men  S3648 Online at Rs.800 in India Only at Flipkart.com. Round Dial, Brown Strap, Stainless Steel Back Case, Water Resistant, Buckle Clasp - Great Discounts, Only Genuine Products, 30 Day Replacement Guarantee, Free Shipping. Cash On Delivery!"
550,Watches,Sonata 8098YM01 Analog Watch  - For Women,"Sonata 8098YM01 Analog Watch  - For Women - Buy Sonata 8098YM01 Analog Watch  - For Women  8098YM01 Online at Rs.1085 in India Only at Flipkart.com. Water Resistant, Round Dial, Stainless Steel Back Case, Deployment Clasp, Golden Strap - Great Discounts, Only Genuine Products, 30 Day Replacement Guarantee, Free Shipping. Cash On Delivery!"
551,Watches,Timewel 1100-N2017 Analog Watch  - For Women,"Timewel 1100-N2017 Analog Watch  - For Women - Buy Timewel 1100-N2017 Analog Watch  - For Women  1100-N2017 Online at Rs.795 in India Only at Flipkart.com. - Great Discounts, Only Genuine Products, 30 Day Replacement Guarantee, Free Shipping. Cash On Delivery!"
552,Watches,Olvin 1697 SM05 Analog Watch  - For Women,"Olvin 1697 SM05 Analog Watch  - For Women - Buy Olvin 1697 SM05 Analog Watch  - For Women  1697 SM05 Online at Rs.999 in India Only at Flipkart.com. - Great Discounts, Only Genuine Products, 30 Day Replacement Guarantee, Free Shipping. Cash On Delivery!"
553,Watches,Sonata 8974PP01 Analog Watch  - For Women,"Sonata 8974PP01 Analog Watch  - For Women - Buy Sonata 8974PP01 Analog Watch  - For Women  8974PP01 Online at Rs.550 in India Only at Flipkart.com. Contemporary Dial, White Strap, Water Resistant - Great Discounts, Only Genuine Products, 30 Day Replacement Guarantee, Free Shipping. Cash On Delivery!"
554,Watches,Timewel 1100-N1192 Analog Watch  - For Men,"Timewel 1100-N1192 Analog Watch  - For Men - Buy Timewel 1100-N1192 Analog Watch  - For Men  1100-N1192 Online at Rs.995 in India Only at Flipkart.com. - Great Discounts, Only Genuine Products, 30 Day Replacement Guarantee, Free Shipping. Cash On Delivery!"
555,Watches,Sonata 7007SL02 Analog Watch  - For Men,"Sonata 7007SL02 Analog Watch  - For Men - Buy Sonata 7007SL02 Analog Watch  - For Men  7007SL02 Online at Rs.725 in India Only at Flipkart.com. Rectangular Dial, Black Strap, Water Resistant, Buckle Clasp - Great Discounts, Only Genuine Products, 30 Day Replacement Guarantee, Free Shipping. Cash On Delivery!"
556,Watches,Timewel 1100-N1639 Analog Watch  - For Women,"Timewel 1100-N1639 Analog Watch  - For Women - Buy Timewel 1100-N1639 Analog Watch  - For Women  1100-N1639 Online at Rs.995 in India Only at Flipkart.com. - Great Discounts, Only Genuine Products, 30 Day Replacement Guarantee, Free Shipping. Cash On Delivery!"
557,Watches,HMT Sonata Gold Plated Watch For Men Sonata Analog Watch  - For Men,"HMT Sonata Gold Plated Watch For Men Sonata Analog Watch  - For Men - Buy HMT Sonata Gold Plated Watch For Men Sonata Analog Watch  - For Men  Sonata Gold Plated Watch For Men Online at Rs.899 in India Only at Flipkart.com. - Great Discounts, Only Genuine Products, 30 Day Replacement Guarantee, Free Shipping. Cash On Delivery!"
558,Watches,Times SD_147 Casual Analog Watch  - For Women,"Times SD_147 Casual Analog Watch  - For Women - Buy Times SD_147 Casual Analog Watch  - For Women  SD_147 Online at Rs.550 in India Only at Flipkart.com. - Great Discounts, Only Genuine Products, 30 Day Replacement Guarantee, Free Shipping. Cash On Delivery!"
559,Watches,Times 101B0101 Sports Analog Watch  - For Boys,"Times 101B0101 Sports Analog Watch  - For Boys - Buy Times 101B0101 Sports Analog Watch  - For Boys  101B0101 Online at Rs.695 in India Only at Flipkart.com. - Great Discounts, Only Genuine Products, 30 Day Replacement Guarantee, Free Shipping. Cash On Delivery!"
560,Watches,Fastrack 9913PP03 Tees Analog Watch  - For Women,"Fastrack 9913PP03 Tees Analog Watch  - For Women - Buy Fastrack 9913PP03 Tees Analog Watch  - For Women  9913PP03 Online at Rs.649 in India Only at Flipkart.com. Red Strap, Stainless Steel Back Case, Square Dial, Water Resistant, Buckle Clasp - Great Discounts, Only Genuine Products, 30 Day Replacement Guarantee, Free Shipping. Cash On Delivery!"
561,Watches,Hourglass HG 006 Analog Watch  - For Men,"Hourglass HG 006 Analog Watch  - For Men - Buy Hourglass HG 006 Analog Watch  - For Men  HG 006 Online at Rs.850 in India Only at Flipkart.com. - Great Discounts, Only Genuine Products, 30 Day Replacement Guarantee, Free Shipping. Cash On Delivery!"
